Heading,Review
Super power!,"Very well written book. It gives you the key to unlock your subconscious power. Instead of reading motivational books which are total nonsense, read this one, its worthy. And love Amazon's delivery in time and awesome offers on books."
Wonderful piece of work by Dr Joseph Murphy,"I've seen many videos on YouTube about the law of attraction and things . When i read this book,i really do feel like it's something really true and i think i need to read it once more and study more and make it work in my life too.."
Must read,There is not doubt that book will make your mind a better place . Will make your mind started thinking positively. It has simple explanation for all the prblms we face for mind .must read
Developing Positive Thinking,Good guidelines given by the author to think positive
go for this if you have not gone through books covering topics like positive thinking,"book is repeating over one idea...go for this if you have not gone through books covering topics like positive thinking, optimism,law of attraction etc..i did not enjoyed reading it"
Five Stars,"Excellent book. If you really want to unlock your potential , follow the book step by step"
Joseph Murphy is an amazing author. Definitely a must read book to everyone ...,Joseph Murphy is an  amazing author.  Definitely a must read book to everyone I gifted this book of kannada  edition to my mother.
Must buy,It's a must buy for those who want to develop their mind through a structural and scientific way. Some lines are repeated but worth to buy.
"A copy and paste of ""Think And Grow Rich""","A copy and paste of ""Think And Grow Rich"". Nothing new."
overall good,"It's ok kind of book, good for it's prize, the content is good I have read 3 chp so far but still it does not have that special something to engross u into it but I won't say it's boring. It's worth being read."
Five Stars,"i have learnt lot from this book. you should read it. if not, you will miss many thing."
Don't buy,"Not an original print edition.Poor paper quality....different from original version which shown in the image. No contents in detailed, no index...etc."
Simple Review,"Well this is only a product review. The book is much better than expected. Though it has an attractive name, but you will find it more interesting with it's contents.The functions of our subconscious mind are described here, much easier than it is.Packing and delivery was really good. Best service from Amazon."
A Must Read for Everyone!,"Such a powerful book! I will read this one again. If offers so much, it must be read again to do justice!!"
Three Stars,Good Book
bestreader,"very to understand, content is nice"
1000% life changing book. I m changing my life by changing my thoughts,I love the book. Its a life changing book. And got lots of motivational thoughts. And I know my subconscious mind very well. Thanks amazon. Keep it up.
Five Stars,EXCELLENT!!!
Effective Book,"Wonderful Book.. Take time to read it, like 2 to 3 pages a day and try to apply in life.."
Please Goahead & read this book...,Wow! The Power of your Subconscious mind are really fantastic and fabulous book.Sir Joseph Murphy was written Superb and you are follow definitely help and work it.Thanku Amazon great packaging and great offer and fastest delivery fully satisfied for service by Amazon.
Excellent one . Must read,Good and practical thoughts . Must read by all. Do not miss to read this book as it has a lot of practical methods.
Good book,Book has really changed my life. I purchased 2 books one for me and other gifted to my friend. I was sure that he gonna like it and that's what happened.
Simply brilliant,Very impactive book....  A must must read for everyone  atleast once...  It will change ur prespective  of  life and mind and will surely help u with  ur life....
Good Motivator,I thought it would be about psychology but turned out it is about faith but definitely worth a read. I will implement learnings I'm real life to see results. Go ahead and read in your spare time for a different experience.
this book became very boring for me,"the author has written same thing many times thoughout the book, after reading few pages of the book, this book became very boring for me."
Excellent Book,A must read book explain our mind. Good cover and pages. Thumbs up!
Life changing book,Best self help book i hav read. Read it reread it and implement its wisdom in your life. Changes the whole perception of mind. dr.murphys best book still best seller since 1963.
Nothing new,"Nothing new, if you have read other self help books or mediation books you will find the messages repetitive"
A must read,"The back cover of the book reads "" A book  that will change your life"" and it surely has changed mine.. Need I say more?"
Miracles do occur,"This bookz got lots n lots of surprises. Its a really gud book wid lots of things to learn n apply it in ur daily life. If u go by the book...u'll hv a feeling of a new life, according to my experience. It gives a lot of positive energy spreading in all directions. Thnx amazon."
5 Stars,Love this Book...A Perfect book for saving yourself from personal crisis.
Nice book,Very nice book. You feel motivated while reading this book. Also it's quite amazing to know how much you can achieve in life and change the situations just by controlling and observing how and what you think.
good,good
Really A mind Changing Book,Oh my god. This book is surely a must buy for everyone. It will surely change the mind of the person whose mind is full of negative thoughts. It will surely bring change in a prrson lifestyle I myself have experienced It.
Awesome book.. great things to learn from this..,It's not only a book but Really an precious gift to yourself .  Your life will change and will be amazing after the first chapter of the book..
????,The book is all about self training. Iam trying to follow it.its really good.Helps to take a different approach in our daily life.
Good,This is fantastic book.Generally i dont prefer to read books but after reading the sample i have decided to read the book.Every one should read this book.
Once u start.. U will feel a hypnotic ...,Once u start.. U will feel a hypnotic effect wbich is ve ry positive and enlightening.. For book lovers.. A must book to keep it wid u??
Five Stars,Awesome book !!! It will Really help You !!! Live Ur Life in a new Way
must buy for people who are curious about understanding the surroundings and human behavior,my mind is just blown by the way the author explains the subconscious mind  and the detailed explanation
The book's quality is OK for the price it is ...,"The book's quality is OK for the price it is offered. But after completing three chapters, it doesn't pull me to this book. Many examples given seems to be impractical."
Good Read.,Bought it to gift a friend. Read the epilogue prior and it seems good. Friend rated the book as a good read
Great and well studied,It is changing my life. I read it every morning and it fills me with confidence and optimism in every chapter. It is showing me the true power of subconscious mind and I'm using it and guess what it is working. Hats off to you Dr. Joseph
Not to miss...,The amazing enhancement of an individual's ability and personality does increase manifold according to my experience... The book has no doubt become a best seller.. A gift worth giving to your companions...
It is a wonderful books. it is more than a Bible,"It is a wonderful books.it is more than a Bible, Quran or any other religious book.i would recommend to read this at least once in a life time.people who are more spiritual especially Christian will understand this book better."
This suggested my friend due to my unfaithful actions on ...,This suggested my friend due to my unfaithful actions on my lifeBook is 18cm as lengthAnd 13cm as width
Remembering the Infinity,Here infinity means your mind ie what you think of yourself either it is evil or generous you are like that. You are the creator of your own thoughts
THIS IS ONE OF THE BOOK WHICH I HIGHLY RECOMMEND. YOU'LL JUST GO LEAPS AND BOUNDS IN YOUR ...,THIS IS ONE OF THE BOOK WHICH I HIGHLY RECOMMEND. YOU'LL JUST GO LEAPS AND BOUNDS IN YOUR SUCCESS PATH.SE A SAMPLE HERE The Power of Your Subconscious Mind
That books change your thinking,This book empowers you to change your itself and do best...it is all about what your are thinking that  will be actually happened in your life.
Amazed by the power we have within,This book can really transform your life. Never know our subconscious mind has so much influence on every aspect of our lives.
Three Stars,"a lil boring and its like the most of the books.., nothing new and interesting...,"
A BOOK DEFINITELY CHANGES YOUR LIFE...!!!,THANK YOU JOSEPH MURPHY FOR A WONDERFUL BOOK WHICH CHANGES EVRYONE LIFE...!!!!
great product.,definitely worth the price ... great product .. will buy again..
Three Stars,Good paper ? and hard ENGLISH WORD USE
Go for it.,1st Great service Amazon.Quality of paper is super. After all it is the essence of reading. Murphy's this book open the possibility of your subconscious mind. Great positive effect.
i cant understand this book and the author from what ...,i cant understand this book and the author from what he is trying to say. not upto the mark
"Basically "" all u want or think of happens in ...","Basically "" all u want or think of happens in your life "" lol ders a whole book which convinces you to believe this"
MIRACLES HAPPEN.,THANK YOU AMAZON AND DR JOSEPH MURPHY YOU CHANGED MY LIFE IN A BETTER WAY.
"Because of it, I am able to use subconscious ...","Because of it,I am able to use subconscious mind .In the whole book Murphy what's to say Always give possitive command to your subconscious mind ."
"love, achieve and many other aspects in our life","Marvellous book! A new way to understand how to live, treat, love, achieve and many other aspects in our life!"
worth reading,for amazon 5/5. for the book 3/5. yes book is worth reading but the content was quite repetitive. simple yet powerful.
Good read,It's a good book. I think it might get 5 also but I m looking for something so big when it comes to 5. It can change the way you think
book.. changed my life,the book that changed my life. it should be read at least once in a lifetime... we should aware that the power of our subconscious mind..may be everybody doesn't believe in it.. but one should need it in  his worst situations...only the god within yourself can change our fortune
A must read for everyone.,If you are feeling low or depressed or anxious or not but this book is for everyone out there. It has made my mind so much clearer.
Amazing..,Amazing..... ideas by Dr josesh Murphy...to control mind... it's really good book....I hope everyone.. at least one time you must read this book
I'm reading it now. Read almost half of the ...,I'm reading it now.Read almost half of the book.... And really our subconscious mind answers when we start asking questions to it.
More than expectations,Awesome
my mind... its just better now,Its a book. Its kinda spiritual also. The techniques r very simple n hardly take an effort but give out good results. Its a must have book
Nice book,Awesome in quality & content... It reaches in time.... Nice to have an another great book in your shelves....
the best book i have ever,this book`s gonna change my life..n i swear m not joking..the best book i have ever read
A must have kind of....,Content is very good.... And so does delivery speed
Five Stars,Excellent book..Definitely changed my way of thinking ..!!!
Five Stars,the super book...must to read it...
Its a great book for people to understand the working of subconscious ...,Its a great book for people to understand the working of subconscious mind.....its also an influence to books like the secret(2006)..as power of sub mind was written in 1963....some people think its the other way around.
Loved it,It's ausum  ...loved it ! But I want more of it ..things which can be practically put into use.it helped
Five Stars,need not compliment it. its superb.
Five Stars,excellent book for Network marketing people and other who are looking for the values in society.
"Lovely, inspiring and revolutionary in thinking too!","Lovely , inspiring and revolutionary in thinking too !"
good read.,good read....author has explained everything in precise manner......one can start doing work on their subconscious mind after readingthis book....and get good results......consistency in a good thought process is a must.........
Power of sub conscious,It has tips for tapping into the sub conscious mind. Only repetition can take you there.
Good Book. Book was delivered within three days,Every one should read this book. Good Book.Book was delivered within three days. This is the first time I received the product very soon.
Read and go for a change,A must read for those who want to understand and harness the power of their mind. Readers will get benefit if they seriously start practising therapies which are suitable for them.
Mindblowing content,Excellent book .. it is a must read book for everyone
Pretty good,"The Quality of the papers are very good.It's a worth reading book. Much more satisfied by this book. Thumbs up for Joseph Murphy and his book ""the power of your subconscious mind"", And Amazon delivery too. Thank you."
Amazing book,amazing book which  i have ever bought
awesome,Biblical contexts are referred to  renew minds which is best thing to learn truth
This book is amazing. Amazon have provided this book @ very low ...,This book is amazing. Amazon have provided this book @ very low price. Everyone should read this book. It will defiantly changed your life that guaranteed. Thanks Dr Joseph Murphy. Thanks Amazon
Amazing book,Amazing book and language is very much easy to understand everybody. Buy this book and read one time in your life.
i m feeling very happy about this,It is a very must books that everyone should read.. i m feeling very happy about this book
Five Stars,Mind blowing..... Go for it
Worthy,Its a very good book for the one who feels low about themselvesEvrything is explained very clearly about concious nd subconcious mind
Five Stars,Inspiring and insightful.. a healing book
5 Star,It's an amazing book for all ages...It help me to be happy n positive by heart.Thnx Amazon for a quick delivery.
Gud one Same lesson as in 'The Secret' and 'Think ...,Gud oneSame lesson as in 'The Secret' and 'Think and Grow Rich'
Very very practical and useful book. If one is aware or know about ...,"Very very practical and useful book.If one is aware or know about the kind of minds,like conscious mind,sub-conscious mind,unconscious mind super conscious mind etc; then he can use this book in a very helpful manner in achieving his/her targets."
Wants books think Amazon,Thanks for delivering before mentioned date.The book condition is awesome...Nice to purchase...Thank you.
An Amazing Experience,"Perfect exercises in this book to achieve anything that you want. Great to have this book.All I do is, pray for 5 minutes before bed and this is really changing a lot? of things in my life.Thank you so much, Dr. Joseph Murphy"
Just started reading it. The author tells you in ...,Just started reading it. The author tells you in the beginning that you need to revisit the content in the book to make it effective for you. Hope so!
Five Stars,Nicely explained in an easy way. At least I want to read the book again and again
AMAZON RULES!,Well if you are buying this book you already know what it is so coming to the delivery and quality got it 5 days earlier and the book is legit and paper quality is awesome.
Five Stars,Definitely u will be into new version after u read this book.simply awesome
) must read for people who love self improvement,This is one of my fave self help book.:) must read for people who love self improvement books
master book,it is a BIBLE who loves self-help books.this book can be read again and again and everytime it would give you the results as promised.just follow the instructions religiously.
"Arrived early, hood quality print and paper. I ...","Arrived early, hood quality print and paper. I have not read the book yet, so can't judge on the content."
Very good,Very good book
Loving you so much my lord.,Fantastic and Fabulous by reading this book....What all has been written in this book are very true. I am very thankful to my god for sending this book to me.
Wonderful!,It is an awesome book for people of all ages. Full of powerful affirmations and ways to deal with fear and negativity.
read it...,"worth read...... a mix of science, philosophy and religion. not my kind of book but yet could not stop turning pages. go for it and its worth some space in your book shelf.."
Nice book,One of the finest book for motivated anyone.....tnx
Knowing about subconscious mind was great.,It is amazing to know the facts about how our subconscious mind works and how we can put it to work In our own way. I am really lucky that I come across this book and finally read.
Must read -Tap the superpower within you.,Mind blowing book which unleashes the super power within each one of us which remains untapped for years. Changes the lens in which you see the world.Must read.
Enjoyed reading this book,Enjoyed reading this book. I recommend everyone to read at least once.Paper quality of the book is not up to the mark!!
Three Stars,One must go for it!
Three Stars,Good
Book Lover,Great book.... every students and other people as well should read this book.You will find your answers here related to your life.
Five Stars,good
Five Stars,Excellent
Must read book for youngsters,I am very successful in my life after reading this book . Trust me read the book once and your life will take the road towards success.
Two Stars,too much religion for my liking!
the best book,One of the best book I ever read who ever feeling sad upset this book will give enrgy to uAnd who and all fail in life best suitable for others give more energy
Five Stars,Very Nice Book .
One of the best self help or life changig book,I read this book after the secret. Though the underlying principles are same but to gain another perspective was wonderful.I would recommend this to everyone as a book  which they can hold on to for life.
"Started reading, not yet completed. But, it ...","Started reading , not yet completed. But, it is encouraging, thought provokong and mind bongling."
Five Stars,Amzing book will definitely improve your state of mind
Five Stars,nice book
It make my habit to always be positive and how ...,It make my habit to always be positive and how to use your sub conscious mind to get what you want just by thinking and affirmation about it.
Inspirational,"Very very good book,recommend to others."
Five Stars,Nice book
Five Stars,Great one and reasonable price. Thank You Amazon.
Five Stars,Very useful book. Simple and lucid style of writing for easy under stand.CHIDAMBARAM. SANKARANKOVIL.
Good,Paper quality is nice
Fantastic Book!,Fantastic Book!!! The best part is the RECAP points given at the end of all chapters..... Continuity in practicing those techniques is the KEY here!!!
Excellent,Brought from Amazing buy.. Quality is upto the mark. Printing is perfect. Book looks good..will start reading now.But kudos!! The book pages r not of inferior quality pr printing.. They r perfcet exactly tge way they mus hv published
Four Stars,GOOD READ
Though we all know Mind is most powerful but this ...,Though we all know Mind is most powerful but this books lets one feel and understand  it while reading. A  must read for those who are curious for self enquiry.
This is the best book that i have come across and if you ...,This is the best book that i have come across and if you keep on reading this on regular basis this would give very good positive impact in your day to day life and it has work with me a lot. So this would be great help.
This book will change your preception about the mind,A great book all should read to know more about our inner self and feel the divinity. This book has to be read again and again to get the best out of it.
Must Read for everyone,"Excellent Book, Must read For everyone to break hardwired mental programming and start a life you deserve"
Incredible book,"I have read this book before and wanted to have a copy of it for myself. The imagination provided in this book will blow you away and the concepts, chapters have been put across in the simplest way possible."
Five Stars,This is horribly awesome.I love it.Have to read multiple times.Completed one time reading.
Awesome book.,Awesome book..requires a lot of believing from the readers side but once we do that it gives us valuable life lessons
Book that may change your life.,"Great great book,  a book one must read it.Believe In yourself  because Law of life is law of belief"
One of the best self help book I've read,One of the best self help book I've read. To get the fullest out of the book practice it. Read one chapter at a time than finishing the book in one go.
Worth a read..,A nice book that'll help you think and be positive amidst your daily struggles in life.. Worth a read..
Good one !,"The quality of the book and its printing is fairly good. I was doubtful about that, because there were no reviews when I wanted to buy it. If you want to read this one, you can certainly buy it !!"
VERY USEFUL BOOK. i DO RECOMMEND THIS BOOK,"VERY USEFUL BOOK. i DO RECOMMEND THIS BOOK. ANY ONE CAN FIND SOLUTIONS FOR THEIR PROBLEMS IN THIS BOOK, EASY TO READ"
Truly Inspiring and  Life Changing Book,Everything is  in the SELF BELIEF.  Go through the Book and LEARN the  use of  SUB CONSCIOUS MIND. Great book by the Author.
Nice thoughts...,Superb book... Revealing the power of our subconscious mind...
Three Stars,Today I start reading so I can't review  but after reading I change my review ????
amazing,feel a positive energy within yourself
Five Stars,Nice book...thanks amazon....
Great...Convincing,This is the only self help book which I liked...even the secret by Rhonda Bryn has been imitation of this book...it's really nice and convincing..
Five Stars,Best book ...recommended ....language was simple to understand...
Must read,Great book
Must read book for every one,Super powerful book
Excellent book...loved it,Excellent book ...must buy
Helping me right now,Very good book.
Good book. Worth buying and reading,Good book. Worth buying and reading
very motivational,If you are a student and facing competition like iit jee Gate etc. Then it will help you to do extra effort on your study...must buy ...
Initially you won't find it logical but when you continue ...,Initially you won't find it logical but when you continue to read this book. You will be able to connect to the writer's mind.
Five Stars,"such an mind blowing boo,suggest for everyone to go through once to have a miracle in life"
This is a really helpful book to unleash and know ...,This is a really helpful book to unleash and know the power within you. Helps to think positively and see many changes based on that . It worked for me.?
Five Stars,Nice book
Best book to divert your thoughts and once you know ...,Best book to divert your thoughts and once you know how mind works then you can alter it in your likable direction. .  It helped me a lot .
Three Stars,"Found nothing worth reading, Unsure how this could be rated No.1 Book in Amazon India Book Store."
Good... Great,Good Book... Learn lots from it.... I liked very much... Best technique describes inside book....
Very good book to read,"Very good book to read. As i continued to read this book on the daily basis, It actually changed the way my mind thinks and my reaction towards the critical situation and people. I enjoyed reading it."
Five Stars,"it will change your think, its reallity"
Changes life for sure. Especially for positive attitude.,Delivery was on time. Book was really mind blowing with high values and words. The writing was very precise and very easily going. Good manifestation.
Life can change...read it,You can never imagin the beauty of this book by just see it.....one of the quality product every one must read plz life is too short to spend on believs and faith this is only book on human book or a well scientific written by Dr. Morphy
Five Stars,Although book has written the same context repeatedly but it frightfully bring the effects slowly and steadily.
Five Stars,Best read ever. Anyone can read this anytime. It's an eye opener
Excellent Book,"One of the must have books, deals with how u can do to have control over your subconscious mind"
Nice,Awesome book it will give you the positive thoughts.
I would say that every one should read this book ...,I would say that every one should read this book at least once and follow the techniques mentioned to achieve any thing in their life :) Must Read .
Worth  your money and time,I bought it for 80 Rupees....Information -  5 stars ( you can Google for the review of the book )Quality of cover - 5 starsQuality of pages - 4 starsDidn't provide any bookmark with book
A must read book ever in life,A must read book by any human being
Classic,Best book ever
Five Stars,Good one.
Loved the book,I wanted this book from so long . Thanks .Also packaging was very different from the all orders I jave received till date but was impressive . I liked it .ThanksPallavi
Don't go for it,I ordered this product on August 2017 and still not receive.. so funny.
every tym thy create problem for customers... ...,every tym thy create problem for customers... replace my items... and this will be my last tym ordering in this app
